{
  "schema_version": "1.0.0",
  "predicate_id": "ADR_ACCEPTED",
  "evidence_phase": "PREPARE",
  "evidence_type": "ADR",
  "canonical_path_pattern": "docs/adr/<ADR-ID>.md",
  "required_agent_role": "adr-owner",
  "allowed_response_contract_statuses": [],
  "required_lifecycle_states": [],
  "required_implementation_statuses": [],
  "required_release_statuses": [],
  "required_validation_result": "PASS",
  "repository_relationship": "SAME",
  "revision_relationship": "EXACT",
  "commit_relationship": "NONE",
  "required_validator": "FCR_AUTHORITY",
  "validator_version_constraint": "EXACT:1.0.0",
  "input_revision_relationship": "EXACT",
  "content_hash_requirement": "REQUIRED",
  "maximum_age_seconds": 0,
  "supersession_rule": "CURRENT_ONLY",
  "stale_rule": "ADR stale",
  "contradiction_rule": "contradictory ADR",
  "invalidation_rule": "ADR hash mismatch",
  "missing_behavior": "BLOCK",
  "failure_error_code": "REGISTRY_DEPENDENCY_INCOMPLETE"
}
