{
  "schema_version": "1.0.0",
  "predicate_id": "DEPENDENCY_TASK_COMPLETE",
  "evidence_phase": "IMPLEMENT",
  "evidence_type": "DEPENDENCY",
  "canonical_path_pattern": "implementation/workflow-state/evidence/<TASK-ID>/implementation.md",
  "required_agent_role": "implementation-agent",
  "allowed_response_contract_statuses": [
    "READY FOR_REVIEW",
    "READY FOR MERGE",
    "DONE"
  ],
  "required_lifecycle_states": [
    "READY_FOR_REVIEW",
    "READY_FOR_MERGE",
    "DONE"
  ],
  "required_implementation_statuses": [
    "COMPLETE"
  ],
  "required_release_statuses": [
    "NOT_RELEASED"
  ],
  "required_validation_result": "PASS",
  "repository_relationship": "SAME",
  "revision_relationship": "EXACT",
  "commit_relationship": "EXACT",
  "required_validator": "FCR_RESPONSE",
  "validator_version_constraint": "MAJOR:1",
  "input_revision_relationship": "EXACT",
  "content_hash_requirement": "REQUIRED",
  "maximum_age_seconds": 0,
  "supersession_rule": "CURRENT_ONLY",
  "stale_rule": "dependency revision mismatch",
  "contradiction_rule": "contradictory evidence",
  "invalidation_rule": "task state mismatch",
  "missing_behavior": "BLOCK",
  "failure_error_code": "REGISTRY_DEPENDENCY_INCOMPLETE"
}
