{
  "schema_version": "1.0.0",
  "predicate_id": "DEPENDENCY_CONTRACT_AVAILABLE",
  "evidence_phase": "PREPARE",
  "evidence_type": "DEPENDENCY",
  "canonical_path_pattern": "implementation/workflow-state/registry/contract-available/<CONTRACT-ID>.json",
  "required_agent_role": "registry-agent",
  "allowed_response_contract_statuses": [],
  "required_lifecycle_states": [],
  "required_implementation_statuses": [],
  "required_release_statuses": [],
  "required_validation_result": "PASS",
  "repository_relationship": "SAME",
  "revision_relationship": "EXACT",
  "commit_relationship": "NONE",
  "required_validator": "FCR_REGISTRY",
  "validator_version_constraint": "EXACT:1.0.0",
  "input_revision_relationship": "EXACT",
  "content_hash_requirement": "REQUIRED",
  "maximum_age_seconds": 0,
  "supersession_rule": "CURRENT_ONLY",
  "stale_rule": "contract stale",
  "contradiction_rule": "contradictory record",
  "invalidation_rule": "contract hash mismatch",
  "missing_behavior": "BLOCK",
  "failure_error_code": "REGISTRY_DEPENDENCY_INCOMPLETE"
}
