{
  "schema_version": "1.0.0",
  "predicate_id": "REVIEW_APPROVED",
  "evidence_phase": "REVIEW",
  "evidence_type": "REVIEW",
  "canonical_path_pattern": "implementation/workflow-state/evidence/<TASK-ID>/review.md",
  "required_agent_role": "review-agent",
  "allowed_response_contract_statuses": [
    "APPROVED",
    "APPROVED WITH FOLLOW-UP"
  ],
  "required_lifecycle_states": [
    "REVIEW",
    "QA",
    "READY_FOR_MERGE"
  ],
  "required_implementation_statuses": [
    "COMPLETE"
  ],
  "required_release_statuses": [
    "NOT_RELEASED"
  ],
  "required_validation_result": "PASS",
  "repository_relationship": "SAME",
  "revision_relationship": "EXACT",
  "commit_relationship": "EXACT",
  "required_validator": "FCR_RESPONSE",
  "validator_version_constraint": "MAJOR:1",
  "input_revision_relationship": "EXACT",
  "content_hash_requirement": "REQUIRED",
  "maximum_age_seconds": 0,
  "supersession_rule": "CURRENT_ONLY",
  "stale_rule": "revision or age exceeds maximum",
  "contradiction_rule": "contradictory or superseded evidence",
  "invalidation_rule": "reviewed commit mismatch",
  "missing_behavior": "BLOCK",
  "failure_error_code": "REGISTRY_EVIDENCE_MISSING"
}
