{
  "schema_version": "1.0.0",
  "predicate_id": "IMPLEMENTATION_COMPLETE",
  "evidence_phase": "IMPLEMENT",
  "evidence_type": "IMPLEMENTATION",
  "canonical_path_pattern": "implementation/workflow-state/evidence/<TASK-ID>/implementation.md",
  "required_agent_role": "implementation-agent",
  "allowed_response_contract_statuses": [
    "READY FOR REVIEW"
  ],
  "required_lifecycle_states": [
    "IMPLEMENTATION_COMPLETE",
    "READY_FOR_REVIEW"
  ],
  "required_implementation_statuses": [
    "COMPLETE"
  ],
  "required_release_statuses": [
    "NOT_RELEASED"
  ],
  "required_validation_result": "PASS",
  "repository_relationship": "SAME",
  "revision_relationship": "DESCENDANT",
  "commit_relationship": "DESCENDANT",
  "required_validator": "FCR_RESPONSE",
  "validator_version_constraint": "MAJOR:1",
  "input_revision_relationship": "EXACT",
  "content_hash_requirement": "REQUIRED",
  "maximum_age_seconds": 0,
  "supersession_rule": "CURRENT_ONLY",
  "stale_rule": "revision or age exceeds maximum",
  "contradiction_rule": "contradictory or superseded evidence",
  "invalidation_rule": "commit or response mismatch",
  "missing_behavior": "BLOCK",
  "failure_error_code": "REGISTRY_EVIDENCE_MISSING"
}
